[
  {
    "case_id": "T3-J1-L3-0013",
    "pearl_level": "L3",
    "domain": "D10",
    "subdomain": "Political Science",
    "difficulty": "Medium",
    "trap_type": "F2",
    "trap_family": "F2",
    "trap_subtype": "Probabilistic Voting",
    "scenario": "A political campaign increased its advertising budget by 50% in swing districts during the 2020 election. The candidate won those districts by an average margin of 2%. Polling showed a 3% boost in name recognition correlated with the ads.",
    "counterfactual_claim": "If the campaign had not increased advertising, the candidate would have lost those swing districts",
    "variables": {
      "X": {"name": "Increased advertising budget", "role": "Antecedent"},
      "Y": {"name": "Winning swing districts", "role": "Consequent"},
      "Z": {"name": "Name recognition boost", "role": "Mechanism"}
    },
    "invariants": ["Same candidate qualities", "Same opponent", "Same economic conditions"],
    "ground_truth": "CONDITIONAL",
    "label": "CONDITIONAL",
    "justification": "Voting behavior is probabilistic, and the 2% margin is within typical polling error. The advertising effect, while likely positive, cannot be deterministically linked to victory. Other factors could have provided the marginal boost.",
    "wise_refusal": "This counterfactual is conditional because electoral outcomes depend on many probabilistic factors. The advertising may have been influential but not necessarily decisive.",
    "key_insight": "Electoral margins within polling error make counterfactual claims about campaign effects inherently uncertain.",
    "initial_author": "Fernando Torres",
    "validator": "Fernando Torres",
    "final_score": 8.5
  },
  {
    "case_id": "T3-J1-L3-0014",
    "pearl_level": "L3",
    "domain": "D10",
    "subdomain": "Public Health",
    "difficulty": "Hard",
    "trap_type": "F2",
    "trap_family": "F2",
    "trap_subtype": "Probabilistic Epidemiology",
    "scenario": "A city implemented a vaccination campaign that achieved 85% coverage. COVID-19 hospitalizations dropped by 70% compared to similar unvaccinated cities. Individual vaccine efficacy was estimated at 80% against severe disease.",
    "counterfactual_claim": "If the vaccination campaign had not occurred, hospitalizations would have been 70% higher",
    "variables": {
      "X": {"name": "Vaccination campaign", "role": "Antecedent"},
      "Y": {"name": "Reduced hospitalizations", "role": "Consequent"},
      "Z": {"name": "Herd immunity effects", "role": "Mechanism"}
    },
    "invariants": ["Same viral variant", "Same healthcare capacity", "Same population demographics"],
    "ground_truth": "CONDITIONAL",
    "label": "CONDITIONAL",
    "justification": "While vaccination clearly reduced hospitalizations, the exact counterfactual depends on assumptions about viral spread dynamics, herd immunity thresholds, and behavioral changes. The 70% figure requires modeling assumptions.",
    "wise_refusal": "This counterfactual requires specifying epidemiological model assumptions. Different models of disease spread and immunity would yield different counterfactual estimates.",
    "key_insight": "Probabilistic disease transmission makes precise counterfactual quantification dependent on model assumptions.",
    "initial_author": "Fernando Torres",
    "validator": "Fernando Torres",
    "final_score": 9.0
  },
  {
    "case_id": "T3-J1-L3-0015",
    "pearl_level": "L3",
    "domain": "D10",
    "subdomain": "Criminology",
    "difficulty": "Medium",
    "trap_type": "F2",
    "trap_family": "F2",
    "trap_subtype": "Probabilistic Deterrence",
    "scenario": "A city increased police foot patrols by 30% in high-crime neighborhoods. Violent crime decreased by 15% over two years. Research suggests each additional patrol reduces crime probability by roughly 5% in the immediate area.",
    "counterfactual_claim": "If police patrols had not increased, violent crime would have remained at previous levels",
    "variables": {
      "X": {"name": "Increased police patrols", "role": "Antecedent"},
      "Y": {"name": "Violent crime reduction", "role": "Consequent"},
      "Z": {"name": "Deterrence effect", "role": "Mechanism"}
    },
    "invariants": ["Same socioeconomic conditions", "Same drug market activity", "Same demographic composition"],
    "ground_truth": "CONDITIONAL",
    "label": "CONDITIONAL",
    "justification": "Crime is influenced by many probabilistic factors. While increased patrols likely contributed to the reduction, economic conditions, social programs, and displacement effects also play roles. The counterfactual requires assumptions about these factors.",
    "wise_refusal": "This counterfactual depends on assumptions about crime displacement, underlying trends, and the relative contribution of patrols versus other factors.",
    "key_insight": "Crime causation involves multiple probabilistic pathways that complicate counterfactual attribution.",
    "initial_author": "Fernando Torres",
    "validator": "Fernando Torres",
    "final_score": 8.5
  },
  {
    "case_id": "T3-J1-L3-0016",
    "pearl_level": "L3",
    "domain": "D10",
    "subdomain": "Education",
    "difficulty": "Easy",
    "trap_type": "F2",
    "trap_family": "F2",
    "trap_subtype": "Probabilistic Achievement",
    "scenario": "A lottery-based scholarship program awarded full tuition to 500 randomly selected low-income students. Graduation rates for recipients were 75% compared to 45% for non-recipients from the same applicant pool.",
    "counterfactual_claim": "If the scholarship recipients had not received funding, their graduation rate would have been 45%",
    "variables": {
      "X": {"name": "Scholarship receipt", "role": "Antecedent"},
      "Y": {"name": "Higher graduation rate", "role": "Consequent"},
      "Z": {"name": "Financial barrier removal", "role": "Mechanism"}
    },
    "invariants": ["Same student ability distribution", "Same college attended", "Same support services"],
    "ground_truth": "VALID",
    "label": "VALID",
    "justification": "The lottery-based assignment creates a natural experiment. Random selection ensures recipients and non-recipients were statistically equivalent, making the graduation rate difference attributable to the scholarship.",
    "wise_refusal": "This counterfactual is valid because the lottery design creates a credible comparison group. The graduation rate difference reflects the causal effect of the scholarship.",
    "key_insight": "Randomized assignment provides strong counterfactual validity even for probabilistic outcomes.",
    "initial_author": "Fernando Torres",
    "validator": "Fernando Torres",
    "final_score": 8.5
  },
  {
    "case_id": "T3-J1-L3-0017",
    "pearl_level": "L3",
    "domain": "D10",
    "subdomain": "Labor Economics",
    "difficulty": "Hard",
    "trap_type": "F2",
    "trap_family": "F2",
    "trap_subtype": "Probabilistic Employment",
    "scenario": "A job training program served 1,000 unemployed workers. After six months, 60% of participants found employment compared to 40% of similar non-participants. The local unemployment rate was declining generally during this period.",
    "counterfactual_claim": "If the job training had not been offered, participant employment would have been 40%",
    "variables": {
      "X": {"name": "Job training program", "role": "Antecedent"},
      "Y": {"name": "Higher employment rate", "role": "Consequent"},
      "Z": {"name": "Skill acquisition", "role": "Mechanism"}
    },
    "invariants": ["Same labor market conditions", "Same worker characteristics", "Same job search intensity"],
    "ground_truth": "INVALID",
    "label": "INVALID",
    "justification": "Program participants self-selected, likely differing in motivation and job-readiness from non-participants. The declining unemployment rate means some would have found jobs anyway. Selection bias invalidates the simple counterfactual comparison.",
    "wise_refusal": "This counterfactual is invalid due to selection bias. Participants who chose to enroll likely differed systematically from non-participants, confounding the comparison.",
    "key_insight": "Self-selection into programs creates bias that invalidates naive counterfactual comparisons.",
    "initial_author": "Fernando Torres",
    "validator": "Fernando Torres",
    "final_score": 9.0
  },
  {
    "case_id": "T3-J1-L3-0018",
    "pearl_level": "L3",
    "domain": "D10",
    "subdomain": "Sociology",
    "difficulty": "Medium",
    "trap_type": "F2",
    "trap_family": "F2",
    "trap_subtype": "Probabilistic Social Mobility",
    "scenario": "A study found that children who attended high-quality preschool had 25% higher lifetime earnings than peers who did not. The preschool program was offered to all families in a specific zip code, with 70% participation.",
    "counterfactual_claim": "If preschool attendees had not participated, they would have earned 25% less over their lifetimes",
    "variables": {
      "X": {"name": "Preschool attendance", "role": "Antecedent"},
      "Y": {"name": "Higher lifetime earnings", "role": "Consequent"},
      "Z": {"name": "Early childhood development", "role": "Mechanism"}
    },
    "invariants": ["Same neighborhood", "Same economic era", "Same educational system"],
    "ground_truth": "CONDITIONAL",
    "label": "CONDITIONAL",
    "justification": "The 30% who did not participate may differ systematically from participants in parental involvement, which itself affects earnings. The counterfactual requires assumptions about whether these differences would persist.",
    "wise_refusal": "This counterfactual depends on whether non-participation was random or reflected family characteristics that independently affect earnings.",
    "key_insight": "Voluntary program participation creates selection effects that complicate lifetime outcome counterfactuals.",
    "initial_author": "Fernando Torres",